{
  "name": "swiss-orange",
  "label": "安全橙 Safety Orange",
  "style": "swiss",
  "description": "警示、强调。深色底 + 亮橙。",
  "colors": {
    "ink": "1a1a1a",
    "paper": "f5f5f5",
    "accent": "FF5F00",
    "accentLight": "ffe8d6",
    "grid": "d0d0d0"
  },
  "background": { "color": "f5f5f5" },
  "backgroundDark": { "color": "1a1a1a" },
  "fonts": { "title": "Microsoft YaHei", "body": "Microsoft YaHei", "mono": "Consolas" }
}
