{
  "name": "swiss-green",
  "label": "柠檬绿 Lime Green",
  "style": "swiss",
  "description": "创新、科技。深色底 + 荧光绿。",
  "colors": {
    "ink": "1a1a1a",
    "paper": "f5f5f5",
    "accent": "CCFF00",
    "accentLight": "f5ffd6",
    "grid": "d0d0d0"
  },
  "background": { "color": "f5f5f5" },
  "backgroundDark": { "color": "1a1a1a" },
  "fonts": { "title": "Microsoft YaHei", "body": "Microsoft YaHei", "mono": "Consolas" }
}
