{
  "name": "swiss-blue",
  "label": "IKB 克莱因蓝 Klein Blue",
  "style": "swiss",
  "description": "极简、冲击力强。克莱因蓝作为高反差功能色。",
  "colors": {
    "ink": "1a1a1a",
    "paper": "f5f5f5",
    "accent": "002FA7",
    "accentLight": "e6ebf7",
    "grid": "d0d0d0"
  },
  "background": { "color": "f5f5f5" },
  "backgroundDark": { "color": "1a1a1a" },
  "fonts": { "title": "Microsoft YaHei", "body": "Microsoft YaHei", "mono": "Consolas" }
}
